term,definition
El pretérito,The Spanish past tense used for completed actions with a definite endpoint (e.g. "ayer comí")
El imperfecto,The Spanish past tense used for ongoing or habitual past actions and background description (e.g. "cuando era joven")
El subjuntivo,A verbal mood used to express doubt, wish, emotion, or hypothetical situations (e.g. "espero que llegues")
Ser vs. estar,"Ser" describes permanent qualities and identity; "estar" describes temporary states and location
El complemento directo,The direct object of a sentence; often replaced by pronouns lo, la, los, or las
El complemento indirecto,The indirect object; replaced by pronouns me, te, le, nos, os, or les — indicates to whom or for whom
Por vs. para,"Por" often means "because of" or "through"; "para" often means "in order to" or "destined for"
El gerundio,The Spanish equivalent of "-ing" form (e.g. "hablando"); used with estar to form progressive tenses
